msg,images,code,lng,description,likeDislike,title,userId,isdeleted,commentCount,profilePicture,createdAt,videoUrl,imagePaths,feedsComment,name,location,id,multiMedia,mediatype,lat
null,null,0,0,"Tap the Tools option at the bottom of the screen, then select Rotate from the menu that appears. At the bottom of the display you'll see an icon the has two arrows pointing at each other, with a dotted vertical line between them. Tap this and you should see your image flip back to a normal orientation.","{userAction:2,dislikes:0,likes:0}",This is test for the iteration,3047,false,0,Images/0da0ca00-cfaf-41e8-ab39-cbff55ec64b3.png,2019-12-31T07:01:24.300193,null,null,null,Ankiish Thapliyal,"K179, Block M, Vishwakarma Park, Laxmi Nagar, New Delhi, Delhi 110092, India",2114,"[{name:Butare.jpg,description:null,likeCount:0,id:3192,place:null,mediatype:1,url:feedsmedia/3047/ba8d9d9b-173a-4804-8fa7-c2b545e23c61.jpg,createAt:0001-01-01T00:00:00},{name:Byumba.jpg,description:null,likeCount:0,id:3193,place:null,mediatype:1,url:feedsmedia/3047/10eb2de5-0020-4da6-b902-8bf0d019cc15.jpg,createAt:0001-01-01T00:00:00},{name:Cyangugu.jpg,description:null,likeCount:0,id:3194,place:null,mediatype:1,url:feedsmedia/3047/e1cfc2eb-ff1e-48f8-8039-153a5231c545.jpg,createAt:0001-01-01T00:00:00},{name:Gisenyi.jpg,description:null,likeCount:0,id:3195,place:null,mediatype:1,url:feedsmedia/3047/12c0192b-7d1d-40d4-b209-3853ecc190c7.jpg,createAt:0001-01-01T00:00:00},{name:Kabuga.jpg,description:null,likeCount:0,id:3196,place:null,mediatype:1,url:feedsmedia/3047/e534b896-c25b-491e-8644-490e0c150423.jpg,createAt:0001-01-01T00:00:00},{name:Kibuye.jpg,description:null,likeCount:0,id:3197,place:null,mediatype:1,url:feedsmedia/3047/70caa341-47b6-423c-89ac-56f54a245772.jpg,createAt:0001-01-01T00:00:00},{name:Kigali.jpg,description:null,likeCount:0,id:3198,place:null,mediatype:1,url:feedsmedia/3047/70fd2b0c-6b25-47d1-907a-aa02c8d261a0.jpg,createAt:0001-01-01T00:00:00},{name:Muhanga.jpg,description:null,likeCount:0,id:3199,place:null,mediatype:1,url:feedsmedia/3047/e299b8d2-30cd-4221-8afa-c4cc6391025d.jpg,createAt:0001-01-01T00:00:00},{name:Nyanza.jpg,description:null,likeCount:0,id:3200,place:null,mediatype:1,url:feedsmedia/3047/32ae591d-b632-4538-8f00-80989d3505e9.jpg,createAt:0001-01-01T00:00:00},{name:Ruhango.jpg,description:null,likeCount:0,id:3201,place:null,mediatype:1,url:feedsmedia/3047/b81eeea4-af94-4b7d-814a-274c558fb999.jpg,createAt:0001-01-01T00:00:00},{name:Ruhengeri.jpg,description:null,likeCount:0,id:3202,place:null,mediatype:1,url:feedsmedia/3047/31f14d97-0406-4b87-95ea-268425331842.jpg,createAt:0001-01-01T00:00:00},{name:Rwamagana.jpg,description:null,likeCount:0,id:3203,place:null,mediatype:1,url:feedsmedia/3047/aa2f22aa-36da-41c9-be31-a0b65c7f11ec.jpg,createAt:0001-01-01T00:00:00}]",0,0
null,null,0,0,"An image URL is an internet address that points directly to a specific image, rather than an entire index, webpage or website. Image URLs typically include the image filename, such as in this example: http://tineye.com/images/widgets/mona.jpg.An image URL is an internet address that points directly to a specific image, rather than an entire index, webpage or website. Image URLs typically include the image filename, such as in this example: http://tineye.com/images/widgets/mona.jpg","{userAction:2,dislikes:0,likes:0}",Test,3046,false,0,Images/8a8a93f3-5696-4387-84e5-ac632cc85ec1.png,2019-12-31T06:46:07.9838438,null,null,null,Aryan Thapliyal,"A-10, Sector 63 Rd, A Block, Sector 65, Noida, Uttar Pradesh 201301, India",2113,"[{name:Mandiana.jpg,description:null,likeCount:0,id:3184,place:null,mediatype:1,url:feedsmedia/3046/75919a6f-b186-4449-a544-a2a3b842983f.jpg,createAt:0001-01-01T00:00:00},{name:Boke.jpg,description:null,likeCount:0,id:3185,place:null,mediatype:1,url:feedsmedia/3046/9cd34a06-a3a6-4012-ae1f-4ce0a168a604.jpg,createAt:0001-01-01T00:00:00},{name:Conakry.jpg,description:null,likeCount:0,id:3186,place:null,mediatype:1,url:feedsmedia/3046/690efb4e-c251-4f76-a82e-cb9a195044af.jpg,createAt:0001-01-01T00:00:00},{name:Dabola.jpg,description:null,likeCount:0,id:3187,place:null,mediatype:1,url:feedsmedia/3046/104e7c91-daf2-41af-98f4-365eb2b98687.jpg,createAt:0001-01-01T00:00:00},{name:Fria.jpg,description:null,likeCount:0,id:3188,place:null,mediatype:1,url:feedsmedia/3046/899de04a-24e7-462f-a094-e1fac95089e0.jpg,createAt:0001-01-01T00:00:00},{name:Kissidougou.jpg,description:null,likeCount:0,id:3189,place:null,mediatype:1,url:feedsmedia/3046/37a81d21-fb2d-4ab3-bae8-1dad224cda37.jpg,createAt:0001-01-01T00:00:00},{name:Labé.jpg,description:null,likeCount:0,id:3190,place:null,mediatype:1,url:feedsmedia/3046/e1962738-f012-44c6-833a-d08fb88d2bac.jpg,createAt:0001-01-01T00:00:00},{name:Nzerekore.jpg,description:null,likeCount:0,id:3191,place:null,mediatype:1,url:feedsmedia/3046/28e01398-af2f-4691-bfad-f3dc2f25b58d.jpg,createAt:0001-01-01T00:00:00}]",0,0
null,null,0,0,".Net is a programming language developed by Microsoft. It was designed to build applications which could run on the Windows platform. The .Net programming language can be used to develop Forms based applications, Web based applications, and Web services.","{userAction:2,dislikes:0,likes:1}",Video Test,3040,false,1,Images/085985b6-0662-4e1d-b5b4-20016d31514f.png,2019-12-30T13:31:27.0998859,null,null,null,Shweta Singh,"CP-8, CP Block Rd, Block CP, Poorvi Pitampura, Pitam Pura, Delhi, 110034, India",2112,"[{name:,description:null,likeCount:0,id:3183,place:null,mediatype:2,url:https://www.youtube.com/embed/h7huHkvPoEE,createAt:0001-01-01T00:00:00}]",0,0
null,null,0,0,".Net is a programming language developed by Microsoft. It was designed to build applications which could run on the Windows platform. The .Net programming language can be used to develop Forms based applications, Web based applications, and Web services.","{userAction:2,dislikes:0,likes:1}",.Net Framework,3040,false,0,Images/085985b6-0662-4e1d-b5b4-20016d31514f.png,2019-12-30T13:28:58.4896644,null,null,null,Shweta Singh,"174, Buddh Vihar, Block Z, Sector 12, Noida, Uttar Pradesh 201301, India",2111,"[{name:Yerevan.jpg,description:null,likeCount:0,id:3182,place:null,mediatype:1,url:feedsmedia/3040/8631984a-0efc-439e-bf00-b7730bdd2313.jpg,createAt:0001-01-01T00:00:00}]",0,0
null,null,0,0,"Software testing is a process, to evaluate the functionality of a software application with an intent to find whether the developed software met the specified requirements or not and to identify the defects to ensure that the product is defect free in order to produce the quality product. Software testing is a process, to evaluate the functionality of a software application with an intent to find whether the developed software met the specified requirements or not and to identify the defects to ensure that the product is defect free in order to produce the quality product","{userAction:2,dislikes:0,likes:1}",Software Testing,3046,false,0,Images/8a8a93f3-5696-4387-84e5-ac632cc85ec1.png,2019-12-30T13:19:54.8840519,null,null,null,Aryan Thapliyal,"Saharanpur Rd, Shanti Nagar, Beribagh, Saharanpur, Uttar Pradesh 247122, India",2110,"[{name:Abovyan.jpg,description:null,likeCount:0,id:3181,place:null,mediatype:1,url:feedsmedia/3046/ab63f603-c690-4fe0-851c-7a6c0bb16b7a.jpg,createAt:0001-01-01T00:00:00}]",0,0
null,null,0,0,"A Search Engine Optimization Specialist is responsible for analyzing, reviewing and implementing websites that are optimized to be picked up by search engines. An SEO specialist will develop content to include keywords or phrases in order to increase traffic to website.A Search Engine Optimization Specialist is responsible for analyzing, reviewing and implementing websites that are optimized to be picked up by search engines. An SEO specialist will develop content to include keywords or phrases in order to increase traffic to website.","{userAction:2,dislikes:0,likes:5}",Test your Text Max Range,3047,false,5,Images/0da0ca00-cfaf-41e8-ab39-cbff55ec64b3.png,2019-12-30T11:54:41.728924,null,null,null,Ankiish Thapliyal,"A-10, Sector 63 Rd, A Block, Sector 65, Noida, Uttar Pradesh 201301, India",2109,"[{name:BMW.jpg,description:null,likeCount:0,id:3177,place:null,mediatype:1,url:feedsmedia/3047/4936912c-18b5-4ad7-92db-0966313b96f9.jpg,createAt:0001-01-01T00:00:00},{name:Mercedes.jpg,description:null,likeCount:0,id:3178,place:null,mediatype:1,url:feedsmedia/3047/fb3dee19-3f65-48eb-b6d3-a3ffd780d454.jpg,createAt:0001-01-01T00:00:00},{name:Starbucks.png,description:null,likeCount:0,id:3179,place:null,mediatype:1,url:feedsmedia/3047/205c0e80-f34e-4edd-a41c-425395b28c6f.png,createAt:0001-01-01T00:00:00},{name:Volkswagen.png,description:null,likeCount:0,id:3180,place:null,mediatype:1,url:feedsmedia/3047/49ec99f6-ee4c-467f-8af3-b6fc4f1fa37d.png,createAt:0001-01-01T00:00:00}]",0,0
null,null,0,0,ghj,"{userAction:2,dislikes:0,likes:1}",hgjgh,3033,false,0,/Images/userimageicon.png,2019-12-30T11:24:52.8786778,null,null,null,sanjay,"Hermannplatz 5-6, 10967 Berlin, Germany",2108,"[{name:images 3.jpg,description:null,likeCount:0,id:3176,place:null,mediatype:1,url:feedsmedia/3033/28cdad70-0407-4f32-88b2-d678f919515e.jpg,createAt:0001-01-01T00:00:00}]",0,0
null,null,0,0,A vacation is what you take when you can no longer take what you’ve been taking,"{userAction:2,dislikes:0,likes:1}",Holiday,3031,false,0,Images/fc8af47d-ef15-4c25-9d3f-a7a58c7444f9.png,2019-12-30T11:01:10.5935467,null,null,null,Ashish Thapliyal,"Laxmi Nagar, Ostwal Nagari, Oswal Nagari, Nalasopara East, Nala Sopara, Maharashtra 401209, India",2107,"[{name:,description:null,likeCount:0,id:3175,place:null,mediatype:2,url:https://www.youtube.com/embed/LaFtAcIrGWA,createAt:0001-01-01T00:00:00}]",0,0
null,null,0,0,fgh,"{userAction:2,dislikes:0,likes:2}",fgh,3035,false,2,Images/4e60754a-e8a7-4db7-b266-f28b2bcf00ae.png,2019-12-30T11:00:50.8960955,null,null,null,n1,"66 Tottenham Court Rd, Bloomsbury, London W1T 2EX, UK",2106,"[{name:images.jpg,description:null,likeCount:0,id:3174,place:null,mediatype:1,url:feedsmedia/3035/05b6683c-b31c-473e-8b8f-c42fc1730bd2.jpg,createAt:0001-01-01T00:00:00}]",0,0
null,null,0,0,dfg,"{userAction:2,dislikes:0,likes:0}",fdg,3034,false,0,/Images/userimageicon.png,2019-12-30T10:53:38.112796,null,null,null,neha,"Tomtom, Odakule, 34433 Beyoğlu/İstanbul, Turkey",2105,"[{name:images.png,description:null,likeCount:0,id:3173,place:null,mediatype:1,url:feedsmedia/3034/2112b430-e4f6-40fc-9b91-412f27de0fef.png,createAt:0001-01-01T00:00:00}]",0,0
null,null,0,0,dfg,"{userAction:2,dislikes:0,likes:0}",dfg,3035,false,0,Images/4e60754a-e8a7-4db7-b266-f28b2bcf00ae.png,2019-12-30T10:50:24.477095,null,null,null,n1,"DF-250 - Planaltina, Brasília - DF, Brazil",2104,"[{name:,description:null,likeCount:0,id:3172,place:null,mediatype:2,url:null,createAt:0001-01-01T00:00:00}]",0,0
null,null,0,0,"A hill station is a town located at a higher elevation than the nearby plain or valley. The term was used mostly in colonial Asia, but also in Africa, for towns founded by European colonial rulers as refuges from the summer heat, up where temperatures are cooler.","{userAction:2,dislikes:0,likes:0}",A hill station,3035,false,0,Images/4e60754a-e8a7-4db7-b266-f28b2bcf00ae.png,2019-12-30T10:49:05.4450841,null,null,null,n1,"C-38, Shimla Road, Devlok Colony, PNB Vihar, Majra, Dehradun, Uttarakhand 248171, India",2103,"[{name:,description:null,likeCount:0,id:3171,place:null,mediatype:2,url:null,createAt:0001-01-01T00:00:00}]",0,0
null,null,0,0,"The best moment in class was when I was in 9th grade in sixth period. That was when I got into poetry and spoken word. Having that character and scene class made my life even greater. Not knowing anything about poetry, hating on poems about reading and writing it in the past. That class was fun in many ways. For example; there was this one time where we had to write our own plays and poems and perform them in front of the class. I felt alive, and the creative side of me came out. When I wrote my first poem in freshman year. I realized that it was fun and unique. I felt like I wanted to write more and more. When I performed my first poem to that class I found my passion. Since that day and today I have written over 400 poems and made two books. I have performed on many stages in small audience and in school. That was a good day for me because I can write my thoughts down and write the truth about the world. Teachers and students can learn from this experience that, you can find what best fits you.","{userAction:2,dislikes:0,likes:0}",Remembering School Days,3042,false,0,Images/80cdd447-4a3a-483f-b222-86989cc3d37e.png,2019-12-30T10:09:43.4080168,null,null,null,faiz,"A-10, Sector 63 Rd, A Block, Sector 65, Noida, Uttar Pradesh 201301, India",2102,"[{name:Event 34.jpg,description:null,likeCount:0,id:3170,place:null,mediatype:1,url:feedsmedia/3042/79cc68c2-9f30-4472-9e07-09bf8eced7a0.jpg,createAt:0001-01-01T00:00:00}]",0,0
null,null,0,0,fsdf,"{userAction:2,dislikes:0,likes:0}",sdf,3035,false,0,Images/4e60754a-e8a7-4db7-b266-f28b2bcf00ae.png,2019-12-30T08:51:50.4672004,null,null,null,n1,"2001 NV-582, Las Vegas, NV 89101, USA",2101,"[{name:,description:null,likeCount:0,id:3169,place:null,mediatype:2,url:https://www.youtube.com/embed/3YhQV3aQmb4,createAt:0001-01-01T00:00:00}]",0,0
null,null,0,0,"Watching TOM AND JERRY with friends","{userAction:2,dislikes:0,likes:2}",Watching TOM AND JERRY with friends,3042,false,2,Images/80cdd447-4a3a-483f-b222-86989cc3d37e.png,2019-12-30T08:00:24.518761,null,null,null,faiz,"A-10, Sector 63 Rd, A Block, Sector 65, Noida, Uttar Pradesh 201301, India",2100,"[{name:,description:null,likeCount:0,id:3168,place:null,mediatype:2,url:<iframe width=\560\ height=\315\ src=\https://www.youtube.com/embed/AGBjI0x9VbM\ frameborder=\0\ allow=\accelerometer; autoplay; encrypted-media; gyroscope; picture-in-picture\ allowfullscreen><\/iframe>,createAt:0001-01-01T00:00:00}]",0,0
null,null,0,0,"Wishing you a Happy New Year with the hope that you will have many blessings in the year to come”.“Nights will be dark but days will be light, wish your life to be always bright – Happy New Year”.“May this year bring new happiness, new goals, new achievements, and a lot of new inspirations for life. Wishing you a year fully loaded with happiness”","{userAction:2,dislikes:0,likes:1}",HAPPY NEW YEAR,3040,false,0,Images/085985b6-0662-4e1d-b5b4-20016d31514f.png,2019-12-30T06:20:38.2713098,null,null,null,Shweta Singh,"George St, Manchester M1 4HN, UK",2099,"[{name:Event 48.jpg,description:null,likeCount:0,id:3166,place:null,mediatype:1,url:feedsmedia/3040/220781c3-f058-4aaa-837c-bd401a779ed1.jpg,createAt:0001-01-01T00:00:00},{name:Event 58.jpg,description:null,likeCount:0,id:3167,place:null,mediatype:1,url:feedsmedia/3040/9718f153-5008-4d7e-9875-baf9a695a111.jpg,createAt:0001-01-01T00:00:00}]",0,0
null,null,0,0,es,"{userAction:2,dislikes:0,likes:3}",WE,3035,false,2,Images/4e60754a-e8a7-4db7-b266-f28b2bcf00ae.png,2019-12-30T05:02:38.8547932,null,null,null,n1,"Delhi Noida Direct Flyway, New Friends Colony, New Delhi, Delhi 110024, India",2098,"[{name:Nainital-Snow-2013-m-2.jpg,description:null,likeCount:0,id:3165,place:null,mediatype:1,url:feedsmedia/3035/1a0762ab-45ea-4590-8a3f-873d706efe12.jpg,createAt:0001-01-01T00:00:00}]",0,0
null,null,0,0,fghfgh,"{userAction:2,dislikes:0,likes:4}",fghfgh,3035,false,2,Images/4e60754a-e8a7-4db7-b266-f28b2bcf00ae.png,2019-12-27T10:55:15.7205452,null,null,null,n1,"Bower School of Music, 10501 FGCU Blvd S, Fort Myers, FL 33965, USA",1099,"[{name:images.jfif,description:null,likeCount:0,id:2166,place:null,mediatype:1,url:feedsmedia/3035/585698b4-6c89-4a51-b438-53e27ed84c83.jfif,createAt:0001-01-01T00:00:00},{name:images2.png,description:null,likeCount:0,id:2167,place:null,mediatype:1,url:feedsmedia/3035/d7071a17-f81a-48a0-83b6-99ca0f9cbb05.png,createAt:0001-01-01T00:00:00}]",0,0
null,null,0,0,dfg,"{userAction:2,dislikes:0,likes:2}",fgfd,3030,false,0,Images/2f6c09a2-d758-45af-8724-e69a6b2eeed4.png,2019-12-27T09:51:24.7152894,null,null,null,singh,"443 N Rodeo Dr, Beverly Hills, CA 90210, USA",1098,"[{name:191205173514-02-white-house-tree-lighting-screengrab-super-tease.jpg,description:null,likeCount:0,id:2165,place:null,mediatype:1,url:feedsmedia/3030/239805ad-e267-4bc5-8852-51cd3b1d328e.jpg,createAt:0001-01-01T00:00:00}]",0,0
null,null,0,0,Attitude is a choice. Happiness is a choice. Optimism is a choice. Kindness is a choice. Giving is a choice. Respect is a choice. Whatever choice you make makes you. Choose wisely.,"{userAction:2,dislikes:1,likes:2}",MY LIFE MY RULES,3046,false,1,Images/8a8a93f3-5696-4387-84e5-ac632cc85ec1.png,2019-12-26T10:56:27.057011,null,null,null,Aryan Thapliyal,"137, Noida Expressway Service Rd, C Block, Sector 44, Noida, Uttar Pradesh 201303, India",1097,"[{name:Event 31.jpg,description:null,likeCount:0,id:2164,place:null,mediatype:1,url:feedsmedia/3046/ffbcb4ed-921f-44ea-ad5a-c22ab38fa53a.jpg,createAt:0001-01-01T00:00:00}]",0,0
null,null,0,0,dfg,"{userAction:2,dislikes:1,likes:3}",dfg,3049,false,1,/Images/userimageicon.png,2019-12-26T09:59:08.2815763,null,null,null,Sophia,"2001 NV-582, Las Vegas, NV 89101, USA",1096,"[{name:indraprastha-resort-dalhousie.jpg,description:null,likeCount:0,id:2163,place:null,mediatype:1,url:feedsmedia/3049/37d175c6-69bb-47c8-9265-e9823425ed65.jpg,createAt:0001-01-01T00:00:00}]",0,0
null,null,0,0,"Puchda Hi Nahi Neha Kakkar Full Video Song, tony kakkar, Puchda Hi Nahin Full Song Neha Kakkar, Rohit Khandelwal,","{userAction:2,dislikes:1,likes:2}",Full Video Song,3029,false,2,Images/eba5299c-5405-45cc-ac33-ef725d3e7bec.png,2019-12-26T09:36:11.7521555,null,null,null,Akku Testing,"443 N Rodeo Dr, Beverly Hills, CA 90210, USA",1095,"[{name:,description:null,likeCount:0,id:2162,place:null,mediatype:2,url:https://www.youtube.com/embed/3nK13MpQMa0,createAt:0001-01-01T00:00:00}]",0,0
null,null,0,0,R,"{userAction:2,dislikes:0,likes:1}",W,3035,false,1,Images/4e60754a-e8a7-4db7-b266-f28b2bcf00ae.png,2019-12-26T09:25:14.4190226,null,null,null,n1,"Nariman Point, Mumbai, Maharashtra 400021, India",1094,"[{name:,description:null,likeCount:0,id:2161,place:null,mediatype:2,url:https://www.youtube.com/embed/WpXSjDeG9xo,createAt:0001-01-01T00:00:00}]",0,0
null,null,0,0,"that used to work and stopped working in a new release) [x] Bug report ... Same problem here, it used to work with 4.3.6, but with 4.4.3 reading empty ","{userAction:2,dislikes:0,likes:1}",Searches related to how to handle the comment,3029,false,1,Images/eba5299c-5405-45cc-ac33-ef725d3e7bec.png,2019-12-26T09:14:28.3878488,null,null,null,Akku Testing,"1 International Dr, Orlando, FL 32819, USA",1093,"[{name:68739601_716769122116043_3583430539496914944_o.jpg,description:null,likeCount:0,id:2160,place:null,mediatype:1,url:feedsmedia/3029/496fbb35-8a27-4bd1-ab0b-c63ec886e168.jpg,createAt:0001-01-01T00:00:00}]",0,0
null,null,0,0,"A non-alcoholic mixed drink is a cocktail-style beverage made without alcoholic ingredients. Cocktails rose in popularity during the 1980s, and became increasingly popular in the 2000s. The use of cocktails has proliferated deep into the drinking culture","{userAction:2,dislikes:0,likes:1}",Mocktails,3031,false,0,Images/fc8af47d-ef15-4c25-9d3f-a7a58c7444f9.png,2019-12-26T09:11:23.7423307,null,null,null,Ashish Thapliyal,"Jaypee Greens Pari Chowk, Tugalpur Village, Greater Noida, Uttar Pradesh 201310, India",1092,"[{name:Event 60.jpg,description:null,likeCount:0,id:2159,place:null,mediatype:1,url:feedsmedia/3031/daec1589-8084-4cb7-afbd-799b18a35d20.jpg,createAt:0001-01-01T00:00:00}]",0,0
null,null,0,0,Snowfall Snowfall Snowfall Snowfall,"{userAction:2,dislikes:0,likes:3}",Snowfall,3049,false,5,/Images/userimageicon.png,2019-12-26T07:39:33.7102417,null,null,null,Sophia,"Bareilly - Nainital Rd, Tallital, Nainital, Uttarakhand 263002, India",1091,"[{name:Nainital-Snow-2013-r-2.jpg,description:null,likeCount:0,id:2158,place:null,mediatype:1,url:feedsmedia/3049/b6503122-a686-4930-8e56-02cd7abba4b4.jpg,createAt:0001-01-01T00:00:00}]",0,0
null,null,0,0,"It’s true that few people think of the Netherlands when planning a beach holiday. But whether you’re just visiting or lucky enough to call this iconic city home, there are plenty of great beaches to enjoy in Amsterdam","{userAction:2,dislikes:1,likes:2}",Amsterdam Beaches,3043,false,3,/Images/userimageicon.png,2019-12-26T07:08:38.4659686,null,null,null,Ritu singh,"Kloveniersburgwal 1, 1012 CW Amsterdam, Netherlands",1090,"[{name:beach of amsterdam.PNG,description:null,likeCount:0,id:2157,place:null,mediatype:1,url:feedsmedia/3043/c5522956-4ab5-408e-b540-16a8c90af9b0.PNG,createAt:0001-01-01T00:00:00}]",0,0
null,null,0,0,"Christmas is celebrated every year on December 25 to mark the birth anniversary of Jesus Christ. The name 'Christmas' is derived from Mass of Christ (or Jesus). In a mass service, Christians remember Jesus, who died for them and then came back to life.","{userAction:2,dislikes:1,likes:5}",Merry Chrismas,3045,false,3,Images/da45be05-a363-4b27-bdf7-1a8c9a912ae1.png,2019-12-26T07:06:40.0592655,null,null,null,shivam,"58, C Block, Phase 2, C Block, Chowk, Noida, Uttar Pradesh 201301, India",1089,"[{name:795f04bd-2971-4f3d-a8b7-ba30a73d91ec.jfif,description:null,likeCount:0,id:2156,place:null,mediatype:1,url:feedsmedia/3045/a0f4d378-1a46-4831-aab5-5e1bb820d58c.jfif,createAt:0001-01-01T00:00:00}]",0,0
null,null,0,0,"Chile might be best known for the outstanding beauty of its natural landscapes, the towns and cities dotted across this nation deserve more attention from foreign visitors. Captivating museums, fine dining and some of South America’s best beaches await in the following major cities in Chile. If you're planning a trip to South America, do not miss the most popular cities in Chile. The capital of Chile, Santiago is a cosmopolitan city, with ample restaurants, bars, hotels, and shopping. The best time to travel Chile is from October till March – in Patagonia December till beginning of March. ","{userAction:2,dislikes:0,likes:4}",About Chile trip in South America,3044,false,4,/Images/userimageicon.png,2019-12-26T07:05:53.8877521,null,null,null,Navya Upadhyay,"Chile España 785, Ñuñoa, Región Metropolitana, Chile",1088,"[{name:chile.JPG,description:null,likeCount:0,id:2155,place:null,mediatype:1,url:feedsmedia/3044/5cd75fb1-1f3b-4fc2-84ed-0a05eae6de98.JPG,createAt:0001-01-01T00:00:00}]",0,0
null,null,0,0,Delhi to Jispa Via Manali,"{userAction:2,dislikes:1,likes:3}",I don't have a bucket list  but my bikeit list  is a mile long,3042,false,5,Images/80cdd447-4a3a-483f-b222-86989cc3d37e.png,2019-12-26T06:36:07.0655516,null,null,null,faiz,"Leh Manali Hwy, Lower keylong village, Keylong, Himachal Pradesh 175132, India",1087,"[{name:IMG_0586.JPG,description:null,likeCount:0,id:2154,place:null,mediatype:1,url:feedsmedia/3042/5674cae9-2631-495c-9a05-0e79cebd5828.JPG,createAt:0001-01-01T00:00:00}]",0,0
null,null,0,0,A beautiful view of Eiffel Tower,"{userAction:2,dislikes:0,likes:5}","Eiffel Tower, Paris",3041,false,8,Images/023d1a36-ef5e-4248-a9a1-900069fe3f28.png,2019-12-26T06:25:28.7673529,null,null,null,Martin Wilson,"1602 Patriot Ave, Paris, TN 38242, USA",1086,"[{name:eiffel.PNG,description:null,likeCount:0,id:2153,place:null,mediatype:1,url:feedsmedia/3041/d10de044-eab6-4e37-a364-996e26889a55.PNG,createAt:0001-01-01T00:00:00}]",0,0
null,null,0,0,"I am a traveler, t born, already been traveled to more than 40 countries, such as France, Italy, the UK and many more and there is no sign that I will stop anytime, so join me with my trips which will allow you to gain an understanding of how people in a completely different part of the world live and function. Basically, I am a travel junkie who is always in planning her next trip.","{userAction:2,dislikes:0,likes:6}",Travel enthusiast,3040,false,5,Images/085985b6-0662-4e1d-b5b4-20016d31514f.png,2019-12-26T06:23:44.2267737,null,null,null,Shweta Singh,"USA Pkwy, Silver Springs, NV 89429, USA",1085,"[{name:Amelia.JPG,description:null,likeCount:0,id:2152,place:null,mediatype:1,url:feedsmedia/3040/d0e37cc4-b450-493c-b89c-703e5acdca70.JPG,createAt:0001-01-01T00:00:00}]",0,0
null,null,0,0,"Lake Tahoe is a place of great excellence that moves wonderment in even the most fatigued of voyagers. Imprint Twain portrayed the stunning territory of gleaming blue waters as the most attractive picture the entire earth manages. Surrounded by perfect pine woods and snowcapped mountain tops, the lake's splendid topaz shading is credited to its profundity of about 1,640 feet, and its crystalline quality originates from the most perfect wellspring of the liquefied day off. Lake Tahoe straddles the CA and Nevada fringe, traversing 22 miles from north to south and 12 miles over. It would require in any event three hours to drive around the whole lake in great climate conditions. Be that as it may, plan on substantially more on the off chance that you need to stop and see the attractions or climb the path.","{userAction:2,dislikes:0,likes:7}",Top-Rated Tourist Attractions at Lake Tahoe,3039,false,5,Images/fe49d058-de88-4805-8e2d-0c002b090d15.png,2019-12-26T06:23:33.8937797,null,null,null,jagjit,"2544 Lake Tahoe Blvd, South Lake Tahoe, CA 96150, USA",1084,"[{name:lake-tahoe-1591339_1280.jpg,description:null,likeCount:0,id:2151,place:null,mediatype:1,url:feedsmedia/3039/25d80f7b-7843-41b7-b480-a72c59d5039d.jpg,createAt:0001-01-01T00:00:00}]",0,0
null,null,0,0,werwe,"{userAction:2,dislikes:0,likes:3}",QQW,1003,false,0,Images/07cac01f-2a12-4125-ba8b-8eff42333925.png,2019-12-26T05:08:07.8013112,null,null,null,Test 2,"Jaypee Greens Pari Chowk, Tugalpur Village, Greater Noida, Uttar Pradesh 201310, India",1083,"[{name:images2.png,description:null,likeCount:0,id:2150,place:null,mediatype:1,url:feedsmedia/1003/0c21e908-f184-4e73-b681-ad94f2bc3128.png,createAt:0001-01-01T00:00:00}]",0,0
